create_time|ip_location|user_id|nickname|content|isSpammer
1711206233|辽宁|7194930398|拉风的瞬间2019|这是要促进一波海产品销售囤货呗|0
1711206212|山东|6634715011|lighting麦坤-|一定要管控好海产品进口 保证食品安全|0
1711206195|天津|6354714900|已远15910|说这有啥用，你能拦得住？！|0
1711206081|浙江|2268059425|可心的夏天来啦|可怕|0
1711206060|陕西|6451689356|PLA-139-铁血战士|日本早就应该在地球上被抹掉了。|1
1711206038|陕西|7316185233|Yennnnnmmmmm|日本能不能单开一个星球生活|1
1711205996|广西|1949619095|花冢艳魂|向日本索赔，不赔就制裁日本|1
1711205874|天津|1459043350|jicklv|自作孽不可活！|0
1711205832|广东|7299043922|夜半盼天光|利好国联水产|0
1711205827|辽宁|1226754585|Fengkw_武阿哥|战败国家就不应该让它拥有核设施，联合国干屁用的。|0
1711205802|天津|1606932734|猪兔啾咪猫猫虫|然并卵。。。。|0
1711205793|浙江|6150190524|洋芋大哥哥|是“核污染水”，不是“核废水”，文中用“核废水”这个词太不负责任！|0
1711205768|四川|6423064747|呆桃超有钱DAYTOY|不是早已经排到大陆了吗，之前还有人在X城市海域测出有核辐射|0
1711205717|安徽|6514900736|喧嚣qvq|真的无语了|0
1711205710|广东|7848842483|星空瓶仑|都不用等到“最后”，就已经没有谁可以幸免。|0
1711205664|河南|2446988432|字左呻|愣着干什么 还不赶快请日本核一顿|0
1711205590|浙江|6474893001|一块大腹肌K|除了强烈谴责还有啥。 我社保交了这么多年还能不能拿的到。|0
1711205507|广东|3703637672|FIRST中国曙光|打倒脚盆鸡|0
1711205437|广东|2181305470|玩水消暑|打吧|0
1711205403|广西|7435063832|宁茄程18677622882|收购核电站|0
1711205395|广西|7435063832|宁茄程18677622882|收购核电站|0
1711205380|广西|7435063832|宁茄程18677622882|收购核电站|0
1711205343|上海|3462051694|bayren0913|好邪恶|0
1711205316|福建|5609522301|警女小飞天|雾草|1
1711205307|中国|6558870929|梦里荒芜岁月|好想揍死那些小日子|1
1711205281|江苏|3661858021|这昵称到底能不能用|发现问题，能解决问题吗|0
1711205216|天津|6572024377|zhaohongyan521|啥也别说了 毁灭吧！|1
1711205212|浙江|7727051807|就是不愿意2021|有意义吗？刀架脖子之前都不干他，现在说什么。海水能截留吗？|0
1711205182|湖南|2501985452|劳资的美丽小手|@修身养性ing_|0
1711205001|四川|5403314955|me米是糕|毁灭吧|1
1711204966|吉林|7810547296|且向危楼俯首|庆幸国家早早的禁止了来自日本的水产品。|0
1711204940|上海|2393755430|花无缺的三维空间|消灭日本！！！????????|1
1711204901|浙江|2169221610|悬崖上的鲤鱼|这么多年过去了，还是抵御不了小日本入侵|0
1711204889|陕西|7546786583|煎饼867|都往西部逃吧|0
1711204839|浙江|1739167371|阿麦一万手|阻止不了啥也没用|0
1711204789|湖北|5650858075|ETdroveUFOaway|倒灌回美国|1
1711204781|河南|3385895174|博采众长ymy|完蛋了，什么海鲜也别吃了。|0
1711204756|江苏|5455323053|颖儿171996|人类啊！|0
1711204721|江苏|6905234837|追求云的心|要死了，江浙沪最先嘎了|1
1711204711|山西|3762411512|行走的人行走的人|送东风快递过去，把岛炸沉|0
1711204651|浙江|7542947083|demonlover一二|作为舟山人瑟瑟发抖|0
1711204643|山东|6100551978|鲁吹一号见了愁|把鬼子轰了吧|0
1711204570|吉林|3736144571|爱做白日梦的阿兹猫|所以什么用都不顶|0
1711204565|云南|6880698843|周三上线|让它返流回日本去，不行就一颗炮弹过去东京|0
1711204562|河北|7193236890|斐丽日系风格首席设计师李文光|都是美国指使的，骂小日子没用。。|1
1711204523|浙江|3365681302|美丽的玉-琰|到了又能怎样，排都排了|0
1711204509|海南|2534171583|PiscesSJ|好的 知道了 关我屁事嘿嘿|1
1711204497|河南|6991587360|18LOVE13|我们沿海还能发展吗，还能旅游吗|0
1711204485|浙江|6623417681|林木桥下|？|0
1711204479|重庆|5634678389|五音不全唱|最受苦的是人家日本百姓。人家都没说话。你说啥？|0
1711204452|浙江|5892155755|岚岚823|关键是到了之后呢，我们该怎么办呢|0
1711204414|江苏|5782271462|有意时大蔚|so？一起毁灭呗|0
1711204369|辽宁|6430837889|我是NI的FEN丝|警察S|0
1711204335|辽宁|6430837889|我是NI的FEN丝|警察|0
1711205342|广东|2943064617|康康deer|实在不知道还能怎么办了|0
1711212742|浙江|1947817227|宝贝求暖家|只有希望海水快一点淹没小日本的岛国！|0
1711205481|广东|2943064617|康康deer|不是预言说中国会成为救世主吗，但是现在遇到了危害全人类的事，目前也没办法解决，所以只能等死吗|0
1711205371|广东|2943064617|康康deer|感觉活一天算一天了|0
1711204335|山东|6491291768|一个路过的222|哦，然后呢。|0
1711206891|江苏|3279370285|小溪奔泪|先将浙沪鲁辽海水采样检测，再把核污水到来之后的海水采样检测，最后评判它的真实危害。基于监测基于科研都应该这么做|0
1711206510|江苏|2365344977|怀旧小白|咱别光抗议，也管管国内的食品安全行不行呢青天大老爷们，别自己吃干净的老百姓吃的全是这个污染那个污染，现在这德性，房贷30年都不用还了，活不到30年|0
1711277432|湖南|2367342313|阿信2367342313|好希望我们中国前头灭了这个小日本|1
1711267791|广东|2230975745|火星人2230975745|应该多研究一下他们排海附近的人的健康状况，毕竟他们先被污染，再制定如何防范的措施。|0
1711254815|青海|6356154730|我说lws|关键是海水??蒸发变成雨???雪??下到连淡水也污染了呀！你说咱们整个地球不就因此而生灵涂炭了吗????//@喜欢阳光的人200503:小日本放毒破坏了海洋海域，又没办法解决，那只能全世界都不要吃海产品不就得了？//@好友18位:抗议了那么久 有卵用|0
1711254493|青海|6356154730|我说lws|就是，比我这个六七十的人还软趴趴??????//@Jason_9471:是的，没卵用，我们就只会抗议，软趴趴！//@好友18位:抗议了那么久 有卵用|0
1711239927|山东|7647155018|我是用户9|不吃海鲜也没用啊，污水排进大海里最后也会变成雨下到我们引用的水里面阿，|0
1711233806|江苏|7903557799|凌华东|要相信专家所说的|0
1711232368|安徽|3042189144|站成路边一棵树|第1段称为核污水，为什么到第2段就改称核废水呢？??|0
1711397616|山东|7574097907|暮溪和|福没享到先享辐了 晦气|0
1711307430|山西|6019406189|闫会95915|狗日的日本人，挑战我们中方的底线|1
1711290193|天津|7751349652|熊牛记ChatGPT|日赖|1
1711287661|黑龙江|5038427800|用户dh6n07rw8w|能不能把小日本炸了！|1
1711209029|河北|6562354111|红衣喏|内蒙古岂不是安然无恙|0
1711209068|河北|7651275913|小狗才说谎啊|核废水不就是冲着中国来的吗？|0
1711238176|云南|7894064208|hdihwcdjwbgj|哼，我忍不了了，我要努力赚钱，长大后灭了日本！！！！！！！！！！！！！！！！！！！！！！！！！！！！！！！！！|1
1711280736|天津|3193870612|伍贰幺柒|这只是鬼子公开排放的时间，谁知道之前偷偷排了多少|0
1711251962|江西|7142949248|Miss-阿喵|本来第一次排海之前我还很焦虑，结果谁也阻止不了。反正已经摆烂了，现在是救不了海洋里的生物，以后就得可怜自己。反正迟早都得毁灭。|0
1711278844|北京|5339536193|Jsetrurpyid|还没有去看过大海就要被污染了|0
1711306165|江苏|7607650728|一个自闭症男孩的妈妈|想起了叶文洁|0
1711256063|黑龙江|7407051978|长风过后lr|我们还没来得及报仇雪恨呢就被小日子毒死了！果然小日子的狼子野心是藏不住！赶快灭了它们吧！|1
1711786005|重庆|5817742582|妖塔里有妖怪|早就到了吧|0
1711406930|江西|1657929897|闲QIN|日本毁灭吧 都别活了|1
1711475338|广西|2350088274|他竟从甲方沦为了设计师|政府不急，我急啥|0
1711584669|广西|6433582490|希林林林林吖|广西呢？海南呢？|0
1711324204|浙江|7558995005|是旺仔哈哈|建议停课 内迁|0
1711321890|广东|1806468772|TA怎么你了|地球毁灭|1
1711298257|河南|1771895951|苍茫冰雨|让日本赔偿呀|1
1711710775|广东|5611698815|韭菜包子2018|转发微博|0
1711633359|广东|5144079554|我姓谈不姓谭|哎，怎么办啊？|0
1704635983|山东|3478872505|掾佐|我都不知道他说得原来这么含蓄……|0
1704636048|福建|7828255899|-痛若骊歌乐如儿歌-|刚刚看到的|0
1704635895|河北|6303696756|世界知名笨蛋|新闻学最后的良心|0
1704635996|广东|6013799189|桀骜仟夜|电台那个老板身份好像有些问题|0
1704635990|北京|2754497817|逆流向西顺流向东|有传言这次地震是因为日本在做核试验三相弹，造成的。所以不让国外救援。是吗？|1
1704636009|贵州|6508791010|为什么改不了实事求是|对传统媒体矫枉过正是必须的，建议再出点人神共愤的事情，来一脚油门。|0
1704636722|浙江|5548520277|hushui_41835|这种平铺直叙客观事实，也就做了一个悲观预期，这有什么问题？哪来的争议，设置这个议题到底是心理阴暗还是语文阅读理解能力低下啊|0
1704636396|上海|7649831352|今天一定十二点就睡|领导会觉得友邦惊诧，可笑的是领导所谓的友邦从来没把你当回事|0
1704636399|山西|6326644877|乔治三鑫|这算过分的话西方电台的都该枪毙|0
1704636510|辽宁|2797879704|珈啡哲学|好像还有说别的吧，报应之类的|0
1711205048|浙江|5518703928|半糖玲珑妆|这种就是侵华日军第二代说不定当初他爸就是鬼子呢！|1
1704636363|浙江|7601521357|拳打殖物来睾废|就客观描述了一下，然后精倭破防了|0
1711205350|上海|7023160552|有生之年61218|还是那个逻辑，都处理好了为什么还排海？不能自己用？|0
1704643259|辽宁|6862341706|素颜出镜三千院|我从小看日本漫画，长大看日本电影，买的车是日本的，家里的电器很多也是日本的，我也没有民族主义。那么，我可以骂日本了吗|1
1709846485|江苏|6856692557|栗子味的小羊|就这么地吧，最近看了不少非洲的纪录片，生命在非洲显得那么轻，一场特别小的感冒都可能要了他们的命。可是他们依然在快乐的生活。我们也要好好的生活呀，做自己想做的事情。|0
1711205313|北京|1257344012|zhaowenli555|原子弹下无冤魂！|1
1704636360|山西|6326644877|乔治三鑫|这言论也叫过分？tmd|1
1709888201|浙江|1655283635|前小时从|我妈说现在海鲜不能吃，都被核废水污染了，吃了人要变异，我说那更要快点吃多吃点，不然人家吃了变异了，我们还没变异，等下我们要被变异人吃掉了，大家都变异就不怕啦|0
1711210350|浙江|2742358494|云又ing|现在日本饮用水已经出现问题了 很快苦果自己尝了|1
1704642010|北京|7088880958|酒厚笑晓|一个说真话的理性媒体人|0
1711215160|山东|7239140320|雨中飘落的往昔|我觉得他说的对，赶紧离开日本。待在这干嘛|0
1704636186|湖北|7762975255|光就是一切的意义|这话说的没有错|0
1709845555|重庆|5635805111|冶濮|怕死就不去|0
1711205301|四川|7336475853|成都牧云记|处理干净了就留着喝呗，干嘛排海里|0
1704637567|河南|1791641453|Narandul|这也叫争议言论？谁在争议站出来@澎湃新闻 @新京报 @凤凰网 @财经网|0
1711400852|山西|2118552594|金蝴蝶探索者杨永兴|应该端杯水让他喝两口|0
1704638379|江苏|6353328410|巴氏李梅烤肉|这话过分在哪呢？过分就过分在在大队长眼里，“编排太君”可是大不敬啊|0
1709846168|福建|6394894785|颜即正义的墙头草|他们早就偷排了，分析说我们国家是影响最小的|0
1711218211|河北|7770922542|畅哥同学|日鬼作恶多端久了就该灭绝了！|1
1704636859|山东|6152136641|AAA热心市民小李|想起来了枣庄一中学cos刺杀安倍晋三|0
1709847807|江苏|6101928541|阿子初|牛new吗|0
1711325046|安徽|3174574580|奇文共欣赏亓爻|反正他也没几年了，他肯定不在意|0
1704640423|北京|3248922235|sugar-HT|说的这么含蓄也要被停职。。。。。|0
1709845547|安徽|5251762935|小狗奎饼卷|别想太多 顾虑顾虑太仔细只会影响食欲|0
1711232239|湖北|2029381397|杨nicholas|这才是真正的“极端民族主义者”。????????|0
1704635946|河南|5536182362|无法53408|说这也没事吧，外边也经常黑我国|1
1709845619|江苏|6407653655|cyangswy_cx0830|前几天看一个测试什么的 好像上海苏州这边影响已经有蛮大的了（不知道真假 反正人就活这么几十年 放开吃吧|0
1711214064|辽宁|7373876978|牛魔201206|他说的没错啊，你还在日本干够吧|0
1709846378|甘肃|1272183572|牧雨空鹤|其实吧 世界是一个巨大的循环 偷排加上正式排放在自然界里早就循环开了 不如该吃吃该喝喝|0
1711207622|广东|6358051491|重回到在路上|小鬼子，你太失礼了，辐射水喝死你们祖宗八十代吧|1
1709845532|河南|5775255486|谁吃了天使的烤Ci膀|放心吃吧，早来了|0
1711261773|山东|7751391011|小青大骂假秃驴|没危险您自己留着喝呗 自己国家自来水循环消化了不就行了 你排向大海不可惜了点|0
1709845575|安徽|5251863487|四更月明|该吃吃该喝喝，能活一天是一天。不要怕。能上桌的应该没事|0
1711222826|河南|6143059782|我的仔仔199306|你为什么去日本呢？|0
1709847097|湖北|7834432589|放肆的积木|随便吧，排海后，下的雨都可能是污染，随便活|0
1711217717|安徽|1858667364|玩世不恭男人该有de范儿|他说的对，有问题为什么还在那待着|0
1709845604|江苏|7126019495|春栀续酒|我是自从知道核污水消息后就没吃过海鲜了|0
1711212058|广东|7281088002|用户华府9527|你说美国，他就跪下给你拉裤链了|0
1709850287|重庆|2649422187|阿音音__|为什么我点个赞屏幕上全是彩虹??|0
1711358986|上海|5852523093|芊芊201602|如果不危险，为什么要远海排放，留着自己用啊。|0
1709855499|北京|6363668331|羽弦forever|别想那么多，大部分人每天熬夜不健康饮食不运动长时间看电子产品对健康的影响比吃不知道带不带核污染的海鲜大多了|0
1711211264|广东|3100270097|碳基成员|鬼子还是鬼子，世世代代都是鬼子！|0
1709846388|江苏|2927682625|我好想你小四|早走晚走都是走放开吃吧|0
1711652701|河南|6347504867|啦啦啦相见不如怀念|既然没问题，那那个水让日本喝不就行了吗？他自己敢喝吗|0
1709854212|天津|6351643825|还不错呦w|你喜欢什么就吃什么喽 干嘛非要回本|0
1711413791|广东|1651918425|姚卓_遥望雪影|对付这种人就是马上掏出一瓶核污染水请他自证水是干净的|0
1709933668|辽宁|5974039082|方圆圆U|吃吧，都排了好多年了，而且不光他一个在排。以前都吃了，也不差现在那几口。|0
1709892051|陕西|5977501628|啊蔬_|害，从排的那一刻就已经影响大了，吃不吃都改变不了了，还不如死之前多快活一下|0
1711578239|广西|1553043360|阿小晓笑笑|所以三月三我要去看大海|0
1711445551|重庆|5120948184|玟yeba|毁灭吧|1
1711260689|山东|6326792610|充话费送的巴啦啦|早就来了|0
1711272894|福建|7859041684|LYN-长腿娃娃菜|我的天哪，我家住平潭|0
1711272940|河南|6977116430|还是希望意外比明天先到来好了|emmmmmmm|0
1711208987|河北|7454129855|名古屋的小泡|中国不是造了个清洁球吗|0
1711744462|山东|3607526624|楼明空|@潜祉|0
1711640085|河南|1887619423|独行毒性独醒|??的|0
1711265947|广东|3323404590|烟火向星辰cy|狗日的，灭绝吧|1
1708038963|山东|6365117007|方脑壳里建秋|食贫道不是去福岛了吗盖革计数器嘎嘎响|0
1708040001|美国|2694640530|李可夫斯基拍原子|20世纪，世界8大污染事故，日本人产出4个。作为top王者，不明白为什么中外有很多人会相信日本人可以处理好这次的重大污染事故|0
1708038890|重庆|1938289960|菜鸟古斯比|外务省的钱不能白花啊|0
1708041785|广东|7088344492|忧郁的兔子10|记得去年有个博主去福岛实地考察了一下，手里的辐射检测器在很多地方都咔咔乱响。还有几个当地老头在常年的宣传福岛的实情被地方政府掩盖了，不作为。连小学门口不远处辐射都超标。|1
1708040464|上海|1342586300|likangauo|唉，我一个大学同学，上海本地人，居然朋友圈还说出了“有信誉度的日本政府”这种话|0
1708041114|广东|6117951558|每天只睡25小时|按日本这几年的尿性，如果他们故意的肯定不止排十几吨水，这特么的看都不够看，那如果真就排了十几吨我是坚定认为他们就是忘记关了|1
1708038623|北京|2973881585|狛爵般爽朗的笑声|克苏鲁主题公园|0
1708041223|加拿大|2389867737|Hanwsp|故意的还是不小心??|0
1708039510|新加坡|5129655874|Akatsiya_|报道一次让全世界知道会这么干，之后就常态化了，他们就这个尿性。|0
1708075009|江苏|3189650954|周一至周五摸鱼|是故意不小心的|0
1708072489|浙江|5132213188|缤纷旗帜战五常|居福岛，享辐射延年|0
1708039408|陕西|7715989742|长安旅行夹|这事感觉可以做个剧本杀了|0
1708217758|吉林|7505042959|橙蓝格子纹|它们不可能是忘记关掉阀门。因为它们就是故意的|0
1708099368|广东|6868497498|一个玩胶片的人|那个什么五岳散人|0
1708081623|浙江|7800342119|HoYo飞士|福岛简直就是生化危机里的浣熊市……|0
1708072744|广东|3201754691|滨周周|鱿鱼，乌贼最多的也是中国。|0
1708039771|上海|1442325507|粕类要西|一个人可能忘记。制度化的工作，这很难忘记吧。|0
1711298298|西藏|7624783087|那就放手一博|拿出一瓶水说这是排放口接的免费请你喝，看这老登敢喝不|0
1711260509|江苏|2691553197|谢工老师|鬼子本来就有小礼而无大义，这种貌似人类的种群整体都这个德行，不要对它们有什么期待|0
1711793120|辽宁|2320257060|强手堂|是为了激怒日本人对在中国的中国人没什么影响，对在日的中国人影响不好，|0
1711564117|北京|7762022458|在昆仑山又钓鱼绘画的小瞧|这个日本人看嘴唇已经中毒了，|1
1711558049|陕西|3142233197|覃巨腾|你去日本干嘛？|0
1711358799|辽宁|7377135804|青青的sunny7812|中国有在日本驻军的权利|0
1711335287|湖南|6226012120|湘人東|你要说中国会来驻军的。波兹坦公告|0
1711236809|新疆|1692676487|帅帅的小盒子|也就只有中国人才核污水吧|1
1711399353|江苏|5659177015|zz小二哲|日本人都该死|1
1711287872|福建|6528166865|悠游天下2008|小日本核食多吃点|0
1711264023|辽宁|6272470713|放飞游游|处理干净你自己喝拉呗，你家那么穷|0
1711534690|上海|5536463137|吴老大-小胡子|可惜当年美国的原子弹太少了！|0
1711299400|浙江|7489660597|请独立行走别蹭了|抹去，不配为人|1
1711225701|北京|6189466169|五彩斑斓的黑卍|怎么能通化日本？|0
1711207274|浙江|7517835682|不长腿的鸟就是我|老头的逻辑是既然有污染为啥你还待在中国|0
1711197265|湖南|1841968552|一颗蓝莓籽-|僵尸脸|0
1712021130|浙江|6981179315|企鹅岛的北极熊|鬼子你们都是坏蛋骨子里血脉里纯坏|1
1712017578|广东|1745616495|唉累着吧|“中日友好”？我呸呸呸呸呸呸呸呸|0
1711966551|浙江|1641038914|黑影企划师叶才三|不愧是二次原的地盘|0
1704642936|辽宁|5111680764|土豆茄子南瓜豆角|原来这样一开始我还觉得有点冲，那我也去关注了|0
1704636832|河南|3806706561|斯如诶|有知识有文化|0
1704636308|上海|2215754612|种花养鱼撸猫|还得涨粉|0
1704656106|广东|1645159247|常识君|这就是面子上能说，和私底下能说的。|0
1704637336|北京|1655253920|郑昀|老胡：这话我也说过……但是我现在转脸就要抽恶狠狠地抽……XP|1
1704636299|北京|5576232997|花明_宁大魔王|讽刺一下都不行了吗|0
1704718083|广东|7486470015|万能大熊的爹|无神论者不应该把天灾和人祸绑定|0
1704701406|江苏|5899754194|kess1_|极端民族主义不可取|0
1704675182|四川|2597510263|阿和你的卡布|这叫争议言论，台长不查一下吗？|0
1704670311|重庆|5760319173|隔江打望2|说得这么含蓄那就是领导有毛病吧|0
1704654978|湖北|5713086881|ArkReich_Khan|下一步是不是就要“侈言抗日不知廉耻者立斩无赦”|0
1704651450|广东|7844326203|胡德女士在海滩|日本人应该庆幸兔子还在对民族主义有所抑制|0
1704649044|安徽|6647121050|孙乾坤L|主持人一身挣钱，无奈他领导卖国啊|0
1704647787|浙江|6621188119|罡风呼啸|是东方网举报了|0
1704647414|湖南|7232714276|步步惊浪|必须支持啊|0
1704646638|广西|5365481949|星宇霜河|他说的这么克制还要被某人发微博讨伐还要被处分，呵呵|0
1704646357|福建|1096947587|剥瓜子小能手|是么时候去带货|0
1704644803|山东|7871214548|-永恒群青-|这要是过分的话桥下彻不得枪毙啊|0
1704642258|黑龙江|6154619199|阿卡拉特的素描本|关键在他的视频标题吧？好像有一句“遭天谴了”|0
1711910594|辽宁|5051467182|小狐仙LU|如果以后没有这种人了  可能占领的时候会有点良心不安吧多点这种人 可能胆道 扔都没负担|0
1711892189|广东|5947644424|红旗下的坏蛋复活版|这不是挺好的嘛，你滚出日本，日本人滚出中国。我们赢两次。|1
1711870909|上海|6370501280|张议7891|小日子身高越来越矮是因为这个？|0
1711849624|美国|7840093885|振轩1004|鬼子的血永远是鬼子|1
1711843666|山西|1823232013|多那太罗|说的没错，你去日本干啥，跑日本爱国去了。别回来。该死哪死哪去|0
1711828731|上海|7000353978|Wuli王可爱啊ab|他爸他奶奶搞不好就被原子弹炸死了（活该），大家就当可怜他了|1
1711791247|河北|5976842560|王均800|大家应该知道中国????还有很多纯日本????学校，不让中国人进，工作人员也全是日本人，这样的学校分布在各个一线城市共32个，这些纯日本????学校多年培养精通各种中国文化的间谍，并改头换面出任各个行业的领导者，潜移默化的改变侵华战争的历史事实|0
1711788736|陕西|5158098233|独家记忆i_爱老虎油|日本民族都是伪君子|0
1711746041|浙江|5943592594|热爱努力U|没毛病 就是没毛病是吧，开始封禁日本所有东西呀，军舰过去训练|0
1711740460|辽宁|5931011562|大脆梨888|鬼子不得好下场|1
1711722406|山东|2806126594|ZLP小狐仙|真是鬼子|1
1711678380|日本|2304592555|Hy_rockk|核处理水|0
1711662950|河北|6196103284|sdfffggg1995|八格牙路|1
1711659612|内蒙古|5178024905|外星人只有一个罗|国际原子能177个国家176个国家无异议，但我是中国人跟国家站在一起。|0
1711624649|安徽|5815562974|美女与野兽的故事999|自取其辱|0
1711622585|黑龙江|6152255662|轩辕超然524|鬼子敢说你怎么不干死他|1
1711538165|辽宁|5534973077|吃瓜群众周知|处理过没问题。你们倒是喝啊！排什么|0
1711487811|辽宁|5233172654|月打明|我有一个办法，先给他冻没知觉，再猛火烘，保留水分控制生机，再注射病毒，发作一段时间，不打麻药切割，研究复杂环境下活体对病毒的应体反应，我的研究生论文就可以完成了。|0
1711478958|山西|2752043687|惠世雄1|打死他|0
1711448134|湖北|1427968633|卷卷娃|小日子 人均 是??|0
1709846555|北京|6184145140|欧式懿yue叻_备考版|阮总：不吃就不会死了？|1
1709845574|四川|3948018412|想去阿泰的飞机|我还是照常在吃哦|0
1709847351|安徽|7798751363|小蜗za|排了大家都跑不了，该吃吃，该喝喝，实在介意就别吃海鲜，但是太多日常东西都会用到水了根本躲不了的|0
1709891005|四川|1937532923|葱是会跳舞的鱼|吃太多导致身体不舒服是得不偿失，就适可而止的吃吧|0
1709849288|黑龙江|5536420965|恶龙没有龙尾巴|安慰自己说不定店里的海鲜都是内陆培养的|0
1709845809|内蒙古|6547382451|奥特曼说我没电了|元旦去青岛玩儿，和司机聊天，他说自己已经完全不吃海鲜了|0
1709848855|河北|1013023420|yi抹丶琉璃白|吃点贵的陆生的？总不能只有海鲜贵吧|0
1709847008|日本|1365814983|一只老花骨朵AcCA|无所谓啦，能活到几岁是几岁了|0
1710243612|北京|2797566904|四个T|流向互联网了|0
1710071320|湖北|5510515947|毛子莲藕汤|怕个唧吧，该吃吃该喝喝|1
1709912752|北京|2290466887|Eany西贝|自助就图吃个花样多吧！之前和朋友吃自助撑到想去医院催吐，真的好难受，从那之后再吃自助就放弃回本的想法了。主打我这来一口那尝一口，除去污染，吃撑也好难受的，不值|0
1709909698|四川|5650836702|说不清的辜负|其实大部分自助餐厅的海鲜都是人工养殖，可能都不是海水养的，饲料催化的产物罢了|0
1709886910|江苏|5650190412|任耀希的白羊|之前苏州不少日料店都公开生鲜产地的，好多都是大连的，那边影响估计没那么快，也有是非洲来的，没啥影响|0
