create_time|ip_location|user_id|nickname|content|isSpammer
1711111425|北京|2054474073|绿色微尘2008|坚持到底！！！！我建议阁下可以从多个点位测量！！！！绘制一幅图！！另外我建议您，把数据记录好！！随时发到网上！！互联网是有记忆的！！！我也建议国家也应该重点检测洋流的变化，特别是日本排放核污染水以后，这些海水流向哪里了？严密监控！！@求是 @新华社 @央视新闻 @CCTV焦点访谈 @人民日报|0
1711201803|广东|6279385791|用户6279385791|朝鲜海底核试验爆破有测吗？？？？@时空点播|0
1711650471|四川|5703136759|评点一哥|胡二狗|0
1711114561|贵州|7336800748|云上小都市|这位是谁？我想关注|0
1711658724|湖北|7903830172|五倍哥|胡狗可以扔进历史垃圾堆了|0
1711114697|江苏|2589420692|沧海桑田2018|应该现在还没有影响到|0
1711711560|新疆|5675414786|love妞妞5376|这种人就该当政治犯关起来|0
1711132246|四川|1276113410|Nicky唐飞宇|保持警惕 保持监督|0
1711649845|上海|6979893051|WC靖国茅厕WC|拿日元说鬼话，胡二鬼是也|1
1711110048|福建|1951762382|mafalda妙分|你每天测我就已经想关注你了|0
1711651763|广东|2818583410|粉红玫瑰的微博|人家后台很硬，说什么也没人敢封号。|0
1711129965|江苏|2042104885|chahuu|解读一下数据呗|0
1711651939|北京|5921192965|阳羡銘壶|别说，他胆子越来越大了|0
1711141626|广西|1653569383|普罗塔|主要是要测海洋生物体内的放射性核素，这些可能进入食物链。|0
1711652915|广东|5681074341|香檳沒有問題|追上未来，抓住它的本质，把未来转变为现在 ——车尔尼雪夫斯基|0
1711698399|四川|7822864749|全球纵论|转发微博|0
1711132669|上海|7876402579|四度痴岁-大同何|转发微博|0
1711655085|辽宁|1992294777|红星照我去流浪|这家伙明目张胆的这么说，怎么就没人能管呢？|0
1711111534|河北|1734481930|我的猫叫塔塔|仪器拿错了|0
1711703918|天津|2296950953|就要随便|一天到晚出来胡沁 ～找人管管吧|0
1711108870|山东|6551629072|小刀g001|看最大值啊，平均数说明不了什么，最大值才是|0
1711674509|广东|2682348331|hgdszfghhjjkhbvhg|他说的还是人话吗|0
1711747968|四川|1590709145|HSEEXS淡然成之|持续关注|0
1711670137|河南|5481474128|开心兮宝|有啥办法让他嘬住嘴，永远嘬住嘴！看到他就恶心，他咋那么能蹦跶，竟然没事？|1
1711222312|辽宁|5151546167|抠脚大鹅|@仙锅炖鹅 秦皇岛还是安全的我觉得|0
1711667533|广东|7483385837|乡下哲学家|胡汉三应该是胡锡进的爸爸|0
1711202813|湖南|1464402832|海盗大哥大|盖革计数器而已|0
1710489794|海南|7871460342|-陌荷|历史会记住这一笔|0
1711657754|广东|1296965024|茶将饮|@胡锡进 真气人，就吃给他们看。|0
1711157566|浙江|7818529997|苏子然2023|你想做什么，你在为谁做这些，稍微有点脑子的人都清楚。不干净的钱少賺。真想做，就去福岛外海测！|0
1710489970|天津|7184114892|Lydiaaa莉迪亚|不错|0
1711665854|山西|6942839569|XHZWYRHHG|众所周知，人说不出这话|0
1710489866|上海|6585406848|息龙榻|dd|0
1711656022|广东|1745616495|唉累着吧|叫他吃、喝多点！！！！！|0
1710489807|辽宁|5664585536|泥有喵饼|是的|0
1711653479|北京|7859338680|无敌加菲二妮儿|胡贼|1
1710489690|北京|2563856605|李小夏de精彩|早|0
1711776508|广东|5747105596|feng39527|胡桑|0
1710489960|广西|5719849898|啾啾小柒|dd|0
1711734400|山西|2612947335|Q-Hua-華|咋就没有人打他呢 ？ 扣棚子屎也行啊|0
1710489852|江西|1863333067|不求闲然只清悠|顶|0
1711716747|山东|2123973442|别瞎逛悠|小蚕豆??比这好吃|0
1710489785|安徽|7832870554|栖野以奈|顶|0
1710490111|福建|7847601315|畫餅日記-|是的|0
1710490100|河北|7637852956|花生什么瓜|顶|0
1710490592|河北|7637852956|花生什么瓜|顶|0
1710489727|江西|6548181123|孙策笨蛋|是的|0
1710489975|湖北|6469785014|XUE乖乖best|说的对|0
1710490162|山西|7755739866|爱老虎-刘|终于停止排放了|0
1710490040|湖北|5810865112|X-大大大大欧气|是的|0
1710490361|辽宁|1698584515|0o秋水仙o0|顶??|0
1710530204|北京|6321171422|朋友都爱我|所以你猜日本为什么来中国收购自来水厂|0
1710598017|陕西|1757258093|西安许姐|这也是暂时停止一下，以后还会排的|0
1710508546|湖南|5834813891|则然然-抵制日本核污水版|pdd等平台上正在大量出售日本鱼蛋白（日本核污水污染的鱼做成的肥料），污染国内土壤、农作物、药材等等，最终会导致患癌等重病危害国民生命健康！希望大家能帮忙多多宣传十分感谢！??|0
1710495730|浙江|1202835575|用户mzg2x0kvcu|排放的是核污水，还有你哪里看到停止排放了，别误导大家|0
1710490109|福建|3934700325|弋起xiao熙熙|真需要好好努力一下|0
1710489206|福建|5668110859|SL苏酥爱喝奶茶947-随时发疯版|同意|0
1710490352|广东|7784853219|寶弋儿|再加把劲继续努力|0
1710489601|北京|7899476597|狮子de秋天|请加油|0
1710518050|广东|7449049543|y小含同学|愿每一个醒来的日子，都有阳光相伴，或许在晴空，或许在心里|0
1710516868|美国|6412188362|铎命小芬芳|像五月的暖阳，青春充满朝气。像破土的新芽，青春充满活力，像欢腾的小河，青春流淌着我们的欢乐与迷惘。青春是稍纵即逝的梦，需要我们好好把握。|0
1710512172|甘肃|5174994950|DokiDoki季夏|让暴风雨来的更猛烈些吧|0
1710507797|江苏|2099572555|动漫奈|家里的零食说它想我了，告辞|0
1710532579|江苏|7298316981|沈敬实夜跑在江苏|晚上好呀|0
1710532504|湖南|7813818741|Tangerine-桑桑|善良犹如一杯清水，透明而纯净，宛如一朵荷花，淡雅而芬芳，恰似一篇乐章，美妙而动听。|0
1710532088|河南|6090385866|叫个大笑姑婆|如果我可以站在宇宙的视角，那么我一定要指挥星星软绵绵的降落在你身旁??|0
1710531559|浙江|7763752754|漪墨07|你在我面前永远都闪闪发光，就像整个宇宙的星光都洒在你身上|0
1710531525|上海|6037288398|晴琴倾心|所谓天才，那就是假话，勤奋的工作才是实在的|0
1710531320|陕西|7787408911|漫渡椿野|相信梦想是价值的源泉，相信眼光决定未来的一切，相信成功的信念比成功本身更重要，相信人生有挫折没有失败，相信生命的质量来自决不妥协的信念。  |0
1710531257|辽宁|5838690376|烟火星辰_Yang|晚上好呀|0
1710531246|福建|5793261019|安心养猫狗|喵喵喵，听说你想养一只猫？|0
1710531129|广东|6437178917|时宜使|人生从来都不完美，各有各的不足，各有各的难处，各有各的烦恼，各有各的生活方式 我们只有过好当下才是最重要的|0
1710530828|天津|7617991508|L拾伍丸子|温暖的话胜似阳光，乐观的人自带光环。|0
1710530811|江西|7737577804|纯元俞宁|“这次我站在花海里,瞒着世俗爱意四起,花海散爱意散,花不散爱意弥漫.”|0
1710530782|上海|2458743132|慕容沁瑜|每日互铁|0
1710530659|上海|5767904351|·月糖·|成功不是将来才有的，而是从决定去做的那一刻起，持续累积而成。|0
1710530613|广东|6090467688|关于扰扰|我所遇见最浪漫的诗，是你；我望山望水望穿秋水，是你|0
1710530378|新疆|5668261454|你玫事柾好|想说些漂亮的话哄你，可是想来想去最漂亮的只有你了|0
1710530367|北京|6326269027|不是甘棠欲染山·|“你的眸是深情的海 满山的花 堕落了我所有的温情”|0
1710530216|山西|6576194152|-顾久沐-|“扬起白帆，与你一同奔赴热爱.”?????????? ?????? ?????????? ???????? ?????? ???? ???? ???????? ???????? ??????.|0
1710530162|江苏|7164022270|震撼我妈力量帝|慈善是有同情心的人们之间的互助行为，慈善是高尚人格的真实标记，滴水穿坚石，爱心美天下，礼发于诚，声发于心，行出于义。心存感恩之心，身行积德之善； 从善者吾近之，从恶者吾远之； 百年养善不足，一日毁之有余； 行善不必人知，积德无需他晓 。|0
1710529994|湖北|6474938796|菲牌除蝒机|生活不是用来妥协的，你退缩得越多，能让你喘息的空间就越有限|0
1710529953|湖北|7748839734|冰亚独奏曲|&quot;晚春那娓娓动听的鸣声,许不尽是我让林鸟带给你的思念&quot;|0
1710529923|上海|6870663446|莎莎这可怎么办|每一次的考验，都有一份收获；每一次的泪水，都有一次醒悟；每一次的磨难，都有生命的财富。|0
1710529874|湖南|7556700521|A_零伍年冬|＂浪漫定格在瑰海中，永不落幕爱意四溅.＂ ?????????????? ???? ?????????? ???? ?????? ?????? ???? ?????????? ?????? ?????????? ????????.|0
1710529868|内蒙古|7452762001|月恒交替在立|Lei??我目光短浅 眼里只有你??'?? ??????????-?????????????? ?????? ?? ???????? ???????? ???????? ?????? ??????.|0
1710529803|安徽|7764757768|灼栀夏槐_|等苦尽甘来的那一天，山河星月都做贺礼?|0
1710529721|海南|7264949132|你很帅多笑笑|见山是山,见水是水,见你即是全世界。|0
1710529698|新疆|5707796713|七落35186|愿你被很多人爱，如果没有，愿你在寂寞中学会宽容|0
1710529633|北京|6973490987|小兔打咩啦|没有梦想也没关系，只要幸福就好了，反正人生只有一次，无论什么都要尝试一次|0
1710529572|辽宁|7830613646|Sorry小睿_|要等时间嘉许，等春风得意，我正好遇见你，然后余生都是你|0
1710529530|陕西|6003934596|琪杯厚乳耶奶|地球是圆的??，和想见的人终会遇见|0
1710529484|广东|7492251535|馥毒姬|喵喵喵，听说你想养一只猫？|0
1710529471|湖南|6871755534|Cora甜心|“我用笔描绘你的美好，携带着落日的温柔，把热爱赠予最值得的你”|0
1710998818|澳大利亚|5489855075|土生土长的房角石|Repost|0
1710687618|湖北|6312896460|姬子跃01|真的吗？我咋有点不相信呢。是不是行现在偷摸的放了|0
1710595023|甘肃|5812331441|ZZ君来有声|真停了？|0
1710630082|湖北|7613236532|用户7613236532|霍霍完了  侵略才有理由  巴西大  日本是会选地的|0
1710625200|江苏|7906633020|用户7906633020|可是开始了吧|0
1710599932|河北|7099207037|用户7099207037|已经重新排放了|0
1710527516|辽宁|7841337399|生活小经济|抵制农夫山泉，更应该抵制欧美日韩的iphone和汽车等科技产品。支持国货，利润才能留在国内继续消费，大家生活才能更好|0
1710490064|湖北|5092707797|雪雪好好好-|了解了|0
1710490013|湖北|6438042212|XUEXUE耶-|说的有道理呢|0
1710531199|北京|5484750879|是否还有个地方|杀光它们|1
1710527592|广东|2238588315|钢铁豆腐块|该死日本|0
1710490332|北京|2636493077|Ahao0321|xiaoriben祸害全球，这个怎么算？|0
1711156068|湖南|7375836664|whlwxy|别人扔??，你非要去用嘴接着|0
1711141476|北京|6332112119|专业沙雕评论|我我我我我|0
1711139674|天津|1902007991|選-哲|排海前多少？|0
1711135015|河北|1840443545|珠珠还是我ok|一起死，没问题|1
1711130579|广东|7721330770|清晓酲慵起|哈哈哈哈广东人虾蟹照吃，两百多一斤嘎嘎香|0
1711121492|河北|1608385790|不想当电工的厨子|智商：智是智，商是商|0
1711117954|四川|1853252743|顽童CK_CD|蹲个原博id|0
1711117290|湖南|7519486352|wangtiantian1997|气|0
1711107861|广东|6332191141|笼里肥猫喵了个咪|严查这货是不是精日洗洁精～|0
1711115911|山东|6052873139|山地车6666|1/9危害更大|0
1711120328|四川|6157262387|用户6157262387|@人民日报|0
1711144846|北京|1562398213|爱上了吃咸菜喝粥|变坏了也晚了。|0
1711141669|湖北|2109343787|超级大大富豪|狗屁不通|0
1711135843|安徽|3175378082|鸡蛋石头866|你应该去日本福岛去测|0
1711135593|辽宁|6208125800|大连华茂|废水与污水应该不一样。问题是：检测还分什么水吗？只是检测被污染的水，排放到大自然点的数据吧！那么，废水还是污水有什么关系呢？！这么难懂吗！//@虎皮青椒别放辣椒:核废水跟核污水不一样//@重型幻影:某国海边也有核电站，然后也有排水。。。辐射计量也会高。。。|0
1711124723|山东|7070086962|lleeoolleeoo|这个只是洋流还没流过来。估计等到初夏的时候。核辐射水差不多就会已经到了。|0
1711105833|北京|7385364988|loved灵魂成长日记|洗个核辐射澡|0
1711696111|安徽|1947926557|江南独孤侠R3|反贼卧底带节奏|1
1711669568|天津|1877787663|东方润泽2010|生出这个玩意的人喝过核污水。他爸爸喝过？|1
1711666603|广东|6397882430|流雲剑心9|胡叫兽|0
1711658839|北京|7764175166|秋日百合花|越来越立场分明了，连墙都不骑了|0
1711661778|四川|2632263807|用户65icm0edhx|别理她最好|0
1711659831|四川|2129989315|紫蔓荆滕断肠客|不准使用殡葬用品了，给他家祖宗十八代烧点核辐产品，还真的挺时髦的！|0
1712050126|江苏|1922780994|妙道常玄|他怎么不先去日本福岛尝鲜？|0
1712040689|四川|2810363224|打秋风的壮汉|岸田锡进，家乡的撒库拉已经泻了还不快回去。|0
1712008978|河南|1104207710|大乾哥儿|好|0
1712006758|甘肃|2637599535|陇南怪谈|已经不装了|0
1711959789|北京|6186548672|是九点零一刻|胡锡进应该是当代胡汉三|0
1711950387|湖北|6118401496|萌妹子小小文武|这种人该关起来|0
1711806056|辽宁|1406298311|吐槽神器|图呢？是他说的还是你说的？图发出来啊。|0
1711790811|浙江|6860511285|狸爸21|胡桑对日本鬼子不错呀，你全家是不是经常在吃，吃出心得来了！|0
1711747901|四川|1590709145|HSEEXS淡然成之|估计这都是吃了说的话。|0
1711706435|河北|7823822135|乐乐乐_003|对，把他先人扒出来让他吃。不过有没有胆子大的给他家这俩活的寄点核辐射海产品！|0
1711702595|江苏|5723093254|暴力小熊君|这照片越看越像低能|0
1711702018|河南|6563141467|落雨轩2009|胡叼盘的后台是谁？一手遮天啊|1
1711701199|陕西|3616391165|幸福宝贝8828|我的评价为什么会屏蔽？我|0
1711694917|山东|5783016254|水滴成海forever|这种人胡说八道该对它处理了|0
1710529444|江苏|6103582165|一韵惊鸿-罗斌|如果希望辉煌，那么就必须脚不停步。|0
1710529361|湖北|7105837098|一级白莲|“见面时 我们的呐喊声定能响彻整片海&quot;纵然世间任我挑，我的选择仍是你|0
1710529256|湖北|7494925475|白树画易|愿你被很多人爱，如果没有，愿你在寂寞中学会宽容|0
1710529230|北京|6973490987|小兔打咩啦|没有梦想也没关系，只要幸福就好了，反正人生只有一次，无论什么都要尝试一次|0
1710528906|山东|7792400056|-可可羲里-|少年就是要在阳光下挥酒汗水。信念和梦想,执着和坚定,与立场无关,与利益无关,简单而纯粹,直击人心。|0
1710528848|宁夏|7807739996|初妍浔洛册|种自己的花，爱自己的宇宙??|0
1710528788|广东|6866435529|小敏慢慢吞|相对于别人，我更喜欢你。这就是相对论|0
1710528759|安徽|1257116932|卷发的鱼|接受落叶和降温的风，也期待来年莺啼和炽热的太阳。|0
1710528740|黑龙江|5824565801|甜豆儿许七安|“月亮近看大 远看小 但我对你的爱意都藏在心里 你知道吗”|0
1710528648|福建|2695008381|瘦陈小腰哲么远|你现在的付出，都会是一种沉淀，它们会默默铺路，只为让你成为更好的人。|0
1710528623|浙江|6535910896|咒剑|你知道我每天都在想吃什么？我每天都在痴痴地望着你|0
1710528468|安徽|7741809619|梵特交响曲|阳光是一种神奇的力量，让我们活得洒脱自在。它像一把无形的手，轻轻抚摸着我们，感受到它的温暖，就沐浴在它的光芒中，把心里的阴郁消散，让心情变得灿烂明亮。|0
1710528330|贵州|7798102350|凝烟歆祎-花间令必爆版|用心甘情愿的态度，过随遇而安的生活。遗憾，随风散去，美好，留在心底。给心灵一米阳光，温暖安放，心若向阳，无畏悲伤。|0
1710528127|北京|2197587727|双倍的木Bonanza|乐观是希望的明灯，它指引着你从危险峡谷中步向坦途|0
1710527866|上海|6904174196|兔系秀典|???????? ???? ?? ?????????????? ???????? ???? ?? , ???????? ???? ?? ???????? ??????.爱是严冬里的一片炽热就像我爱你.|0
1710527819|广东|7745130206|柯檬有约|盐于律己，甜以待人(*?▽?*)|0
1710527815|广东|6570614533|首席恋兔官|纵拥千千晚星，唯你是我眼中的星辰?|0
1710527740|山东|7018477499|树莓冰冰乐|如果不想浪费光阴的话，要么静下心来读点书，要么去赚点钱，这两点对你将来都有用，感觉累的时候，坚持下去，你就会发现到达了人生的另一个高度。|0
1710527591|内蒙古|6017100506|肉丸出面|海的对岸是海，书的结局是书，我的心里是你|0
1711126163|江苏|5834402238|蓑雨横渡|哥们！戴手套穿隔离服啊啊啊啊！不嫌脏的啊|0
1711122514|河南|7793290002|春树乀暮云|取水时戴手套做好防护|0
1711122280|江苏|1223330587|独向西风|有啥意义？|0
1711124265|四川|5589744563|古怪精灵84823|连灌尿的勇气都没有，都好意思来蹭流量|0
1711126276|四川|6227858098|别光喝酒啊吃口头孢|倒他们楼顶水箱啊|0
1711125114|青海|1495703842|巴绝战舰|点赞，小伙注意安全|0
1711288364|湖北|5669102732|西门叶鸿|核污水！！！|0
1711207219|中国香港|2156278943|搬運工周百通88|[贊][贊][贊]|0
1711167239|湖南|5512078383|酷拉皮卡-SC|应该叫核污水！|0
1711130726|浙江|5266279088|在世神龙4708|注意安全|0
1711124649|江苏|3303111935|海什么水|应该倒到它们的供水系统里|0
1711122040|江西|1951729710|说你呢_发癫的时候请匿名|干得漂亮！|0
1711138492|广东|6213960219|王火火鱼鱼|只能说，注意安全|0
1711124148|陕西|5102849558|YodaAsuka|b站up主挑战什么什么来着|0
1711242919|山西|1258053132|joan64|对不起 我想让你先弄清楚核废水跟核污水|0
1711143658|云南|1868819375|吃瓜木土木木|看不懂有啥意义，可能可以吸引一些盲目人群的流量吧|0
1711129125|北京|7428457946|Hedy628|蠢|0
1711273007|江西|7671633738|用户7671633738|够有勇气！|0
1711675646|河南|2693974977|C蘇格拉沒底|汉奸，二鬼子不会这么想|1
1711536942|四川|3064752162|丨Shiren|日本的任何物品都不该买!|0
1711530202|辽宁|2084085545|喝过你的咖啡|打倒小日本|0
1711544851|北京|6342010120|酒泉火箭|不买日货|0
1711545784|北京|5339577726|青青晴晴123|咱们能不能打弯弯的时候给日本扔氢??总这么排全人类都得倒霉|0
1711555684|山西|5834813891|则然然-抵制日本核污水版|pdd等平台上正在大量出售日本鱼蛋白（日本核污水污染的鱼做成的肥料），污染国内土壤、农作物、药材等等，最终会导致患癌等重病危害国民生命健康！希望大家能帮忙多多宣传十分感谢！??|0
1711568516|上海|1828286900|艾米的世界|那就不要进口日本地肥   国家严管|0
1711563742|北京|6535112217|xinxin555995|那中国为什么要进口呢？|0
1711541088|广东|5895222596|可乐猫哈巴狗2016|是的，日本人死绝|0
1711570817|陕西|3319978055|青枫归处_208|就是，为啥要进口，还出了海关|0
1711593093|湖南|3996329800|尘可出|主要是内外勾结，人民觉醒有啥用|0
1711569443|广东|2252177384|敌人的敌人就是朋友A|这是日本向我们发起的另一场战争！|0
1711579232|福建|3021331031|叶茂于田|海关变海开吗？防线在哪里？？|0
1711567690|福建|3603273804|美-微香|日产的产品国人们不要进口，不要使用|0
1711582498|上海|6174391001|静如处子妖|这个老百姓没有办法，只有靠政府部门严格把关啊|0
1711557585|广东|5012322594|热血丹心_|#日本# @则然然-抵制日本核污水版:pdd等平台上正在大量出售日本鱼蛋白（日本核污水污染的鱼做成的肥料），污染国内土壤、农作物、药材等等，最终会导致患癌等重病危害国民生命健康！希望大家能帮忙多多宣传十分感谢！??|0
1711747917|四川|1590709145|HSEEXS淡然成之|可恶|0
1711639312|四川|6507178979|愿你三冬暖05|拆除小鬼子学校，全面抵制日货|1
1711634772|云南|6732631026|今天也要拿第一|真的是要杜绝买任何日货。|0
1711622297|河南|2313967255|944啦|抵制一切日货|0
1711197455|上海|1561033334|玩家羊小驼|大哥好样的，但是建议做一些保护措施，你接水的时候手碰到核废水了！注意安全和健康！|0
1711128624|广东|7726911754|凤舞九天1212|可以|0
1711122414|广东|7813066765|夜色f1|核污水|0
1711693955|湖南|2393680667|陈春79|惊喜上新！抽华为mate60pro现货立发；抽888大礼包含百元加油券、免费洗车等福利；还有9.9购视频月卡，会员专享5折起|0
1711693309|辽宁|1337265190|戏曲作家葛学忠|不支持！我勒个去！|0
1711687100|广东|1827210282|锐哥哥有话说|玩样都不是|0
1711676986|北京|1161589601|蓝天还是内个蓝天|壶西进三日杂余孽|0
1711668939|陕西|3319978055|青枫归处_208|怕不是日狗后代吧|1
1711662965|江苏|7399947584|春天花花花__|胡狗，歪屁股|1
1711660541|河南|2693974977|C蘇格拉沒底|神经了|1
1711654922|湖南|7028837110|简单吧YYL|这样的为什么还能活跃在国内的平台上|0
1711653409|重庆|5476465059|最爱那道风景96097|这种人还还能发表言论|0
1711654869|辽宁|5285027041|知易行难1974|实况转播 这货全家天天吃|0
1712041583|北京|3282937442|幸运的白衣胜雪|胡是个什么玩意儿，在网络上怎么冒出来的|0
1711809957|山西|1051753354|极微细尘2020|他可真是从头坏到脚底板|0
1711797895|山东|7734960080|生活小YANG|胡拉稀|0
1711748600|重庆|6792834558|juefeik|锡进太郎，请你先做表率，全家喝核污水用核污水|0
1711704153|北京|1054174321|从哪儿到哪儿|简直无语了|0
1711666526|四川|3288669161|手机用户3288669161|胡维佳回国吃了，我就吃。坏种。|0
1711663391|河南|6276835580|我爱你黄鹤6276835580|胡了|0
1711656157|安徽|3273824283|zst山中老虎|以前还以为是好人，现在看来也不是什么好东西。|0
1711694624|新疆|5308196074|西域风风|胡咧咧已经是网络公戝了|0
1711668593|广西|6646061642|qianghuai林|这就是间谍|0
1711647987|广东|3181170011|波猪i|世界可以没有日本，但不能没有海洋。|0
1711648066|广东|5785023774|这场游戏那场梦aA|天天排都是一样的，没人管|0
1711648061|江苏|1824555782|刀是砍不了蚊子的|人为制造的人类灾难|0
1711648176|中国|7853914346|野绫嘴比石头硬|光报道也没人管 有什么用呢|0
1711648009|辽宁|1310376084|鹿娜z|祸害众生|0
1711648049|广西|1422827341|Johnkit_Chum|日本人是有小礼而无大德，最后就是三鞠躬道歉完事！|0
1711648428|广东|6636351939|琪姐再努力点_|悲哀的是 就看着它们排 然后却没有办法。。|0
1711648052|安徽|7801290713|欧阳家的男孩|该来个大地震大火山爆灭了他们世界才能安全|0
1711648048|广东|3484506840|V了个Vivi|核污水要到我们沿海了|0
1711648023|北京|7303558871|清wind1224|到目前为止，也没有组织他们的办法|0
1711649034|广西|6573055012|鸰梦|不要购买日本的任何产品|0
1711648013|浙江|7881894158|超超的超开心200205|太坏了|0
1711648047|上海|6486280187|没人能比我知道你的温柔像羽毛|丧尽天良|0
1711647988|四川|7884514236|Biiii7_|太恐怖了吧|0
1711648049|辽宁|5690423534|旅大风情|祸祸地球吧！…………|0
1711648010|四川|7578619829|Jerry还在这|能不能赶紧灭了它|0
1711648165|浙江|5269811239|myfavouriteD|怎么办大海都被污染了|0
1711648408|黑龙江|2297594397|山楂球儿的舒曼波|天道好轮回|0
1711659705|北京|1902298885|北京高生|大祸害|0
1711656767|河南|6620078059|六识梦幻泡影|能不能把日本打包发送去其它星球！|0
1710527553|广西|6207227218|啊啊啊啊啊啊禾呐_|“你是世间最可爱的小星星，我爱了整个宇宙，只为和你碰头”|0
1710527488|湖南|5655099084|棒棒糖微甜_|快乐要懂得分享才能加倍快乐，美好的生命应该充满期待惊喜和感激。|0
1710527449|上海|6585406848|息龙榻|是的|0
1710527305|中国|7757083595|娱依依|山花烂漫，只为你而开，奔赴万里，只为你而来??|0
1710526706|浙江|7709169306|Augenstern-KikuYu|不必在意世俗的眼光 去追寻属于你的光|0
1710526586|四川|2756020350|雪雁0000|我是可爱的女孩子，你是可爱我是可爱的女孩子，你是可爱|0
1710526538|山西|6508400661|纹枰不夜城|仍然有开在泥泞里的花，有明晃晃的夏天。我喜欢这个世界更喜欢你。|0
1710525832|辽宁|1698584515|0o秋水仙o0|答案交给时间寻觅，未来不负时光所期。|0
1710525591|湖北|7366625380|我真的要谢|一直关注你的作品|0
1710525329|陕西|5724372796|做梦当闲鱼|一个人看风景，两个人看心情??|0
1710525280|中国香港|6301606290|BABYMORETIME|愿你被很多人爱，如果没有，愿你在寂寞中学会宽容|0
1710525083|浙江|1792759374|32号科技所|下午好呀|0
